{
  "schemaVersion": 1,
  "readerId": "reader:unsupervised-is-a-permission",
  "sourceId": "_4Ph2dhmUFI",
  "sourceAidSha256": "139fbbf83ee7dcd6ebb30a3970e05378cee50622796bca70712f3bf81f3f9ca9",
  "articleSha256": "f5600ef857c92f30a017adb06b8179ba493340d3e8c37ccfdddbf85682e70607",
  "evidenceRevision": "c992f91d95c9c93ff0c452d37ee5f81f0e0b9d0d16e12290bd4428961d3032ae",
  "reviewedAt": "2026-10-21T05:45:23Z",
  "provenance": {
    "kind": "codex-task-agent",
    "reference": "Read-only independent editorial reviewer /root/editorial_review in the incumbent sole-publisher task; full public-candidate review and targeted recheck retained in that task.",
    "limits": "CI cannot authenticate a private agent or prove source truth. The reviewer compared private automatic-caption timing aids but did not replicate first-party study, product or financial results."
  },
  "summary": "Independent reviewer compared all four exact public HTML pages, catalog claims and graph, source maps, receipts and generated projections with the privately qualified sources; no factual, graph, timestamp or source-privacy blocker remained after two targeted repairs.",
  "findings": [
    "A forecast cue initially mapped to 12:07 was corrected to the explicit 17:18 source moment; the article link and source-map hash were rechecked.",
    "The autonomy Reader's provenance now calls the Anthropic and OpenAI evidence separate first-party reports from other operators, not independent accounts.",
    "All eight new typed relationship target anchors resolve and retain qualified editorial comparisons rather than cross-source corroboration.",
    "The public pages use click-to-load 16:9 players and contain no private path, media, full captions or long source-caption overlap; public thumbnail requests occur before click.",
    "Automatic captions are timing aids; benchmark, operator, product and trading claims remain first-party or unreplicated, and Coinbase regulatory status is company-attributed."
  ],
  "conclusion": "accept-for-owner-review"
}
