{
  "schemaVersion": 1,
  "readerId": "reader:the-engine-is-not-the-service",
  "sourceId": "deepseek-ai-deepinfer-774ce244",
  "sourceAidSha256": "904289606d33e1d950d19e260c7d921aee462831f2d44dd9d55b1fe767bc2d55",
  "articleSha256": "4d1e11134a655828b60e42002365ddf73a7e8acda48cf846805381b854dd05c7",
  "evidenceRevision": "6a62f69aba7f86ae9e146326ded3ca6f61f7c1e8ede4c5afdcfd4ee34078eaf7",
  "reviewedAt": "2026-10-21T04:36:01Z",
  "provenance": {
    "kind": "codex-task-agent",
    "reference": "Read-only independent editorial reviewer /root/editorial_review in the incumbent sole-publisher task; original findings and focused re-review retained in that task.",
    "limits": "This record accurately reports a private task review but CI cannot authenticate the agent identity or prove source truth. Tony must inspect the findings and candidate before his own content decision."
  },
  "summary": "Pinned DeepInfer source, original article, source map, catalog claims, quantitative denominators, alternatives, graph and privacy were reviewed. Initial citation and map defects were corrected before focused re-review.",
  "findings": [
    "Initial catalog citations used /tree/ paths for individual files; four URLs were corrected to exact-commit /blob/ paths.",
    "Initial cue map omitted first-party evaluation reference figures and operator cluster/economics figures; #quality and #control points now bind them with unreplicated limits.",
    "Focused re-review found no remaining factual, attribution, graph or privacy defect in the exact authored article and source map. First-party performance and quality numbers remain unreplicated."
  ],
  "conclusion": "accept-for-owner-review"
}
