{
  "schemaVersion": 1,
  "readerId": "reader:what-a-swarm-makes-us-see",
  "sourceId": "TW8F34-ExvI",
  "sourceAidSha256": "4668e788ec0a8edac7fefbf009582065a4fd2a101340ee58a60e327b2fc86f61",
  "articleSha256": "fb8080b1d8682257013b6dd47f1aa9aae8d50facea1f6cbeb3ca6ad9a2bed29a",
  "evidenceRevision": "7cdae9d2a960c92dabc81f28f655fa11bc9a2ef3eca0c089e5b41190bc81755f",
  "reviewedAt": "2026-10-22T12:59:53Z",
  "provenance": {
    "kind": "codex-task-agent",
    "reference": "Independent read-only editorial review of PR 63 at article SHA-256 fb8080b1d8682257013b6dd47f1aa9aae8d50facea1f6cbeb3ca6ad9a2bed29a, completed October 22, 2026.",
    "limits": "Reviewer examined source claims, mathematics, perceptual research and article depth but did not inspect private frames, continuous video, audio, preview layout or all six Zenodo deposits."
  },
  "summary": "Independent editorial review found no blocking factual or depth defect in the approved article. The mathematical scope, artwork-versus-implementation distinction and perceptual uncertainty are appropriately bounded. Visual sample coverage and source privacy remain qualified by the separate private operator receipt.",
  "findings": [
    "The article treats the work as audiovisual art and separates visible sampled formations from creator assertions about agent count, production method, soundtrack and simulation code.",
    "The reviewed Bolduc v07 manuscript supports a finite prescribed-history endpoint characterization, not an unrestricted online distributed convergence or physical rendezvous theorem.",
    "The distinct Blondin-Hale and Naderi-Blondin-Roy papers, oscillator model and perceptual studies are not presented as validation of this film or its audience response.",
    "The proposed state, render and viewer experiments are identifiable as future tests; Tony’s personal response and private media are absent from the public article.",
    "A source-map cue used circle as a verb for the sampled 18:20 formation. It was narrowed to surround to describe a still rather than imply observed motion; authored article bytes did not change.",
    "Review did not independently inspect the private frames, soundtrack, continuous motion, hosted layout or every creator-linked deposit; those remain limits of this acceptance."
  ],
  "conclusion": "accept-for-owner-review"
}
